,Unnamed: 0,level_0,company,date,post_title,rating,text,position,location,tab,subjectivity,sentiment,lang
5991,5991,,ST Engineering,10/1/2022,Good Employer,5.0,Pros: 1. Fair Practices 2. Good Technologies 3. Supportive Management. Cons: 1. Slow career progression 2. Lacks inter departmental coordination,Regional Sales Manager- India,New Delhi,reviews,objective,neutral,
5992,5992,,ST Engineering,9/1/2022,Implement,5.0,Pros: Design and implement build house. Cons: Work jab hard work make hard working,Manager,Jeddah,reviews,objective,neutral,
5993,5993,,ST Engineering,5/1/2022,Great company!,5.0,"Pros: Great team culture, upward mobility.. Cons: There really aren't any cons that I can think of.",Anonymous Employee,,reviews,objective,neutral,
5996,5996,,ST Engineering,11/12/2021,Hello.,5.0,Pros: I am a pro at other things!. Cons: Please Roblox. This Is My Dream Thing.,Senior Engineer,"Flatgap, KY",reviews,objective,neutral,
6009,6009,,ST Engineering,16/9/2021,,1.0,"Pros: A work environment that was very relaxed and laid back, tightknit colleagues.. Cons: A work envoronment that was too relaxed and laid back.",Flight Instructor,Ballarat,reviews,objective,neutral,
6014,6014,,ST Engineering,6/7/2021,Love this Company,5.0,Pros: Great team and environment to work in.. Cons: No cons to report. Love my job.,Quality Assurance,"Baltimore, MD",reviews,objective,neutral,
6016,6016,,ST Engineering,4/7/2021,Exciting place to work with new technologies,5.0,"Pros: Flexibility, exciting projects and opportunity to learn new techs. Cons: Lack of clear carrier paths and frequent changes in leadership",Senior Software Engineer,Killarney,reviews,objective,neutral,
6018,6018,,ST Engineering,27/6/2021,Very Good,5.0,"Pros: everything is good, salary ontime. Cons: most of the project is based on government",Anonymous Employee,,reviews,objective,neutral,
6023,6023,,ST Engineering,14/6/2021,good,5.0,"Pros: good, better, the best, interest. Cons: bad, not good co-worker, boring",Engineer,Vi·ªát Tr√¨,reviews,objective,neutral,
6031,6031,,ST Engineering,4/4/2021,"Constantly challenging, but working with very smart people",5.0,"Pros: Flexible with time and PTO Very knowledgeable, intelligent people work here You are constantly pushed to expand your learning. Cons: Large volume of work You need to be flexible with time as well Need to be mostly or entirely self sufficient Often changing timelines and priorities (it's agile) Very meticulous work, documentation, some bugs can take weeks to resolve/document/validate","Engineer II, Software","Herndon, VA",reviews,objective,neutral,
6038,6038,,ST Engineering,11/2/2021,Satcom at former newtec,5.0,Pros: Interesting work across many sector. Cons: Sometimes not very clear who is responsible for what,Engineer,Sint-Niklaas,reviews,objective,neutral,
6041,6041,,ST Engineering,18/1/2021,Don‚Äôt do it,1.0,Pros: 5 day week not 7. Cons: The world is bigger than Singapore,Project Manager,"Stansted, England",reviews,objective,neutral,
6048,6048,,ST Engineering,9/7/2020,None,1.0,Pros: I like the hours and overtime. Cons: I'm not sure I haven't started yet,Tooling Engineer,,reviews,objective,neutral,
6052,6052,,ST Engineering,11/7/2019,Review,5.0,"Pros: Good environment and salary, good employees and is safe. Cons: There are no cons for the company",Safety Officer,,reviews,objective,neutral,
