,Unnamed: 0,level_0,company,date,post_title,rating,text,position,location,tab,subjectivity,sentiment,lang
825,825,840.0,My First Skool,2021-08-28,Great school,5.0,Pros: Great teamwork and Supportive colleagues.. Cons: Too much of paperwork to be completed,Childcare Teacher,Singapore,reviews,subjective,neutral,en
4658,4658,,My First Skool,26/9/2020,-,5.0,Good company benefit of $5 when visiting doctor.,-,Singapore,benefits,subjective,positive,
12672,12672,,My First Skool,20/9/2022,"Positive vibes, fast pace and family oriented",5.0,Pros: Staff wellbeing & wellness are being taken care of. Organisation always believe that all their employees are good. Clarity of our career pathway. Good colleagues and very respectful.. Cons: Always busy all year round - back to back events and programmes.,Preschool Principal,,reviews,subjective,positive,
12676,12676,,My First Skool,23/8/2022,Principal,5.0,Pros: Good slaray structure paid higher than the market rate. Cons: HR does not look into matters deeply and biasness is the key to success for all hierarchys in this organisation.,Assistant Teacher,"Bedok New Town, ",reviews,subjective,negative,
12683,12683,,My First Skool,23/8/2022,"Be careful with the company, management and backstabbing colleagues.",1.0,"Pros: Medical benefits is the only thing that’s good. Cons: Toxic management, such a parent pleaser. Lick boot kind mindset Some colleagues are competitive unnecessarily when we should be working together Management will expect you to break sweat and bone for the job HR has zero understanding towards employees.",Educator,Singapore,reviews,subjective,negative,
12694,12694,,My First Skool,23/6/2022,Bad for Mental Health,1.0,"Pros: benefits and literally nothing else. Cons: - work-life balance is non-existent - principal and dcl are basically like vultures waiting for something to happen so they can swoop down and reprimand you - for those that seeks a centre that would bring out your creative side, DON'T come here. everything has to be done in a specific way, down to the fonts used when printing display words in class. - higher ups don't care about mental health, it's more of ""We have a gift for you!"" and just stuff your face with presents and benefits BUT it's not worth it.",English Teacher,"Hougang New Town, ",reviews,subjective,negative,
12717,12717,,My First Skool,10/1/2022,-,5.0,Pros: Good colleague and able to communicate well. Cons: No disadvantages are that i find,Student Care Mentor,Singapore,reviews,subjective,positive,
12721,12721,,My First Skool,14/12/2021,Good experience,5.0,Pros: HR is nice and the process for hiring is fast.. Cons: Nothing as it is pretty hassle free,Relief Teacher,,reviews,subjective,positive,
12743,12743,,My First Skool,12/3/2021,Improves your knowledge on how childcare works,5.0,Pros: Good benefits with appreciative parents as I have been there for a very long time.. Cons: Be ready for more challenging colleagues,Lead Teacher,Western Islands,reviews,subjective,positive,
